{"analysis_only":true,"approved_size":0,"available_at":"2026-08-06T19:15:00.320000Z","canonical_envelopes":[{"available_at_utc":"2026-08-06T19:15:00.320000Z","clock_drift_us":1000,"event_time_utc":"2026-08-06T19:14:59.900000Z","exchange_time_utc":"2026-08-06T19:14:59.900000Z","out_of_order_delay_us":201000,"process_time_utc":"2026-08-06T19:15:00.320000Z","processing_latency_us":20000,"raw":{"available_at":"2026-08-06T19:15:00.320000Z","clock_domain":"WALL_CLOCK_ONLY","event_time":"2026-08-06T19:14:59.900000Z","exchange_time":"2026-08-06T19:14:59.900000Z","instrument_id":"btc-eur-spot","monotonic_time":null,"process_time":"2026-08-06T19:15:00.320000Z","raw_timestamp":"2026-08-06T19:14:59.899000Z","receive_time":"2026-08-06T19:15:00.300000Z","record_id":"kraken-record-3-late","revision_id":0,"schema_version":"raw-timestamp-envelope-v1","sequence_id":1,"source_id":"kraken-public-spot-metadata","source_time":"2026-08-06T19:14:59.899000Z","source_timezone":"UTC","timestamp_precision":"MICROSECONDS","usable_from":"2026-08-06T19:15:00.320000Z"},"receive_time_utc":"2026-08-06T19:15:00.300000Z","schema_version":"canonical-time-envelope-v1","source_time_utc":"2026-08-06T19:14:59.899000Z","total_latency_us":420000,"transport_latency_us":400000,"usable_from_utc":"2026-08-06T19:15:00.320000Z","validation_state":"VALIDATED_TEMPORAL_ONLY"},{"available_at_utc":"2026-08-06T19:15:00.171000Z","clock_drift_us":1000,"event_time_utc":"2026-08-06T19:15:00.101000Z","exchange_time_utc":"2026-08-06T19:15:00.101000Z","out_of_order_delay_us":0,"process_time_utc":"2026-08-06T19:15:00.171000Z","processing_latency_us":20000,"raw":{"available_at":"2026-08-06T19:15:00.171000Z","clock_domain":"PROCESS_MONOTONIC_NS","event_time":"2026-08-06T19:15:00.101000Z","exchange_time":"2026-08-06T19:15:00.101000Z","instrument_id":"btc-eur-spot","monotonic_time":1000000000,"process_time":"2026-08-06T19:15:00.171000Z","raw_timestamp":"2026-08-06T21:15:00.100000+02:00","receive_time":"2026-08-06T19:15:00.151000Z","record_id":"bitstamp-record-1","revision_id":0,"schema_version":"raw-timestamp-envelope-v1","sequence_id":1,"source_id":"bitstamp-public-spot-metadata","source_time":"2026-08-06T21:15:00.100000+02:00","source_timezone":"Europe/Paris","timestamp_precision":"MICROSECONDS","usable_from":"2026-08-06T19:15:00.171000Z"},"receive_time_utc":"2026-08-06T19:15:00.151000Z","schema_version":"canonical-time-envelope-v1","source_time_utc":"2026-08-06T19:15:00.100000Z","total_latency_us":70000,"transport_latency_us":50000,"usable_from_utc":"2026-08-06T19:15:00.171000Z","validation_state":"VALIDATED_TEMPORAL_ONLY"},{"available_at_utc":"2026-08-06T19:15:00.181000Z","clock_drift_us":500,"event_time_utc":"2026-08-06T19:15:00.101000Z","exchange_time_utc":"2026-08-06T19:15:00.101000Z","out_of_order_delay_us":0,"process_time_utc":"2026-08-06T19:15:00.181000Z","processing_latency_us":20000,"raw":{"available_at":"2026-08-06T19:15:00.181000Z","clock_domain":"PROCESS_MONOTONIC_NS","event_time":"2026-08-06T19:15:00.101000Z","exchange_time":"2026-08-06T19:15:00.101000Z","instrument_id":"btc-eur-spot","monotonic_time":1001000000,"process_time":"2026-08-06T19:15:00.181000Z","raw_timestamp":"2026-08-06T19:15:00.100500Z","receive_time":"2026-08-06T19:15:00.161000Z","record_id":"coinbase-record-2","revision_id":0,"schema_version":"raw-timestamp-envelope-v1","sequence_id":2,"source_id":"coinbase-public-spot-metadata","source_time":"2026-08-06T19:15:00.100500Z","source_timezone":"UTC","timestamp_precision":"MICROSECONDS","usable_from":"2026-08-06T19:15:00.181000Z"},"receive_time_utc":"2026-08-06T19:15:00.161000Z","schema_version":"canonical-time-envelope-v1","source_time_utc":"2026-08-06T19:15:00.100500Z","total_latency_us":80000,"transport_latency_us":60000,"usable_from_utc":"2026-08-06T19:15:00.181000Z","validation_state":"VALIDATED_TEMPORAL_ONLY"}],"clock_health":{"max_clock_drift_us":5000,"max_out_of_order_delay_us":500000,"max_total_latency_us":500000,"observed_clock_drift_us":1000,"observed_out_of_order_delay_us":201000,"observed_total_latency_us":420000,"reason_codes":["CLOCK_THRESHOLDS_SATISFIED"],"schema_version":"clock-health-state-v1","status":"HEALTHY"},"event_time":"2026-08-06T19:15:00.320000Z","execution_allowed":false,"external_connectivity_allowed":false,"generated_at":"2026-08-06T19:15:00.320000Z","lineage":{"available_at":"2026-08-06T19:15:00.320000Z","instrument_registry_checksum":"5d514b9a7242d119495e85bc1b56b368e74610f699083007e26c95fddfc83e24","instrument_registry_path":"data/audit/instrument_registry_lot32.json","lineage_id":"lot33-from-certified-lot32-instrument-registry","lot32_audit_checksum":"3d71d44a77829dacb8f6477334814205594ba83c958ce1c8cd54d6210f2f4deb","lot32_state_checksum":"54c721735281161912854b3567e1b6e9e30fb7683bf6f00fc721590ca6037871","schema_version":"lot33-lineage-envelope-v1"},"metrics":{"lot_33_out_of_order_records_total":1,"lot_33_processing_latency_us":0,"lot_33_records_processed_total":3,"lot_33_validation_failures_total":0,"schema_version":"lot33-metrics-v1"},"network_ingestion_allowed":false,"order_routing_allowed":false,"output_checksum":"4bb5f8df3b49a8a54b6a932a37d35a4575edc63f897c55e88df90dfaf000f450","real_credentials_allowed":false,"reason_codes":["LOT33_ENTRY_GATE_VERIFIED","LOT32_INSTRUMENT_LINEAGE_VERIFIED","TIMESTAMPS_CANONICALIZED_TO_UTC","RAW_TIMEZONE_AND_PRECISION_PRESERVED","AVAILABLE_AT_ANTI_LOOKAHEAD_VERIFIED","CLOCK_HEALTH_EVALUATED","EXTERNAL_CONNECTIVITY_DISABLED","LOT34_REMAINS_LOCKED"],"risk_approval_allowed":false,"run_context":{"code_commit":"f4762cb7d68fd11a42962f8016f8af22e2bc1c5a","config_version":"lot33-timestamp-governance-config-v1","correlation_id":"lot33-v3-temporal-governance","run_id":"lot33-temporal-governance-certification-run","runtime_mode":"DATA_GOVERNANCE_ONLY","schema_version":"run-context-v1"},"schema_version":"timestamp-clock-timezone-governance-state-v1","signal_generation_allowed":false,"trade_allowed":false,"used_for_decision":false,"validation_state":"VALIDATED_TEMPORAL_ONLY"}
